{"dimension_presence":{"decisional":{"observation_count":5,"status":"observed"},"epistemic":{"observation_count":2,"status":"observed"},"rhetorical":{"observation_count":2,"status":"observed"},"semantic":{"observation_count":3,"status":"observed"}},"measurements":{"advanced_stylometry":{"reason_code":"OUT_OF_SCOPE_V1","status":"not_computed","value":null},"nonblank_lines":182,"scope":"raw_markdown_body","unicode_code_points":12963,"utf8_bytes":13041},"method":{"instructions_hash":"045c72931d2ee40cc7541e40631f58fdff19aded62a0aa89fd3c60f6de4ae085","instructions_version":"author-extractor/1.2","measurement_version":"raw-body-counts/1","prepare_version":"prepare/1","schema_hash":"7de97394f5b8739ef123095468097d76ee9854771fc6732ce450d006537af649","segmentation_version":"raw-blank-lines/1","workflow_version":"host-session-whole-article/1"},"observations":[{"description":"L'apertura incornicia l'ampliamento del progetto come sviluppo di una curiosità pratica sulla fase lunare.","dimension":"rhetorical","evidence":[{"article_id":"A10","passage_id":"P0001","quote":"Ci sono progetti che iniziano con un'idea semplice e finiscono per diventare qualcosa di più grande. Questo è uno di quelli. Tutto è partito da una domanda banale: *posso sapere dalla mia dashboard di Home Assistant in che fase è la Luna stasera?* La risposta è ovviamente sì — ma una volta aperta quella porta, è difficile fermarsi."}],"id":"A10::O0001","inference_kind":"inferred","label":"Cornice di curiosità pratica","review_status":"unreviewed"},{"description":"Nella presentazione del progetto, il termine astrometria indica una dashboard dedicata ai fenomeni celesti e alle attività spaziali.","dimension":"semantic","evidence":[{"article_id":"A10","passage_id":"P0002","quote":"Quello che descrivo in questa serie di articoli è una dashboard di **astrometria** — una parola un po' altisonante per dire: uno schermo dedicato a tutto quello che succede sopra la nostra testa, dai cicli lunari all'attività solare, dalle aurore boreali ai prossimi lanci spaziali."}],"id":"A10::O0002","inference_kind":"explicit","label":"Definizione locale di astrometria","review_status":"unreviewed"},{"description":"L'articolo presenta come possibile l'utilità della dashboard per astrofili, appassionati di astrofotografia e chi valuta se osservare il cielo.","dimension":"epistemic","evidence":[{"article_id":"A10","passage_id":"P0002","quote":"Tuttavia, non è nemmeno del tutto inutile: astrofili, appassionati di astrofotografia, o semplicemente chi vuole sapere se stasera vale la pena alzare lo sguardo potrebbero trovarvi informazioni utili."}],"id":"A10::O0003","inference_kind":"explicit","label":"Utilità potenziale della dashboard","review_status":"unreviewed"},{"description":"Il procedimento introduce un sensore template per adattare la data corrente al formato richiesto dall'API.","dimension":"decisional","evidence":[{"article_id":"A10","passage_id":"P0018","quote":"Il problema è il formato della data: l'API si aspetta `2026-05-10T14:00`, ma i template Jinja2 di HA hanno `now()` che restituisce un oggetto datetime completo. Serve un passo intermedio."},{"article_id":"A10","passage_id":"P0020","quote":"Creo un **template sensor** che formatta la data corrente nel formato esatto richiesto dall'API:"}],"id":"A10::O0004","inference_kind":"explicit","label":"Adattamento del formato temporale","review_status":"unreviewed"},{"description":"L'articolo circoscrive al momento della scrittura il vincolo di configurare il REST sensor soltanto tramite YAML.","dimension":"epistemic","evidence":[{"article_id":"A10","passage_id":"P0024","quote":"Ora uso questo sensore come parte dell'URL nella `resource_template` del REST sensor. Questo, invece, ad oggi può essere solo configurato tramite Yaml:"}],"id":"A10::O0005","inference_kind":"explicit","label":"Vincolo YAML temporalmente circoscritto","review_status":"unreviewed"},{"description":"Il procedimento prevede la formattazione diretta della data corrente nella risorsa REST se il sensore temporale non è disponibile all'avvio.","dimension":"decisional","evidence":[{"article_id":"A10","passage_id":"P0027","quote":"- **Il fallback**: se il sensore della data non è ancora disponibile al boot, uso `now().strftime(...)` direttamente nella `resource_template`."}],"id":"A10::O0006","inference_kind":"explicit","label":"Fallback temporale all'avvio","review_status":"unreviewed"},{"description":"La conservazione dell'intero oggetto dell'immagine è motivata dalla possibilità di accedere in futuro ai campi dell'API senza modificare la configurazione.","dimension":"decisional","evidence":[{"article_id":"A10","passage_id":"P0027","quote":"- **`json_attributes: [image]`**: salvo l'intero oggetto `image` come attributo del sensore, non solo l'URL. Questo mi permette di accedere a tutti i campi restituiti dall'API in futuro senza modificare la configurazione."}],"id":"A10::O0007","inference_kind":"explicit","label":"Conservazione dell'oggetto immagine","review_status":"unreviewed"},{"description":"L'articolo distingue l'URL testuale restituito dal REST sensor dall'immagine da visualizzare.","dimension":"semantic","evidence":[{"article_id":"A10","passage_id":"P0030","quote":"Un REST sensor restituisce testo (l'URL), non l'immagine stessa."}],"id":"A10::O0008","inference_kind":"explicit","label":"Distinzione tra URL e immagine","review_status":"unreviewed"},{"description":"Il calcolo interno della fase nella card lunare è giustificato come ridondanza in caso di indisponibilità dell'API NASA.","dimension":"decisional","evidence":[{"article_id":"A10","passage_id":"P0046","quote":"`use_default: true` dice alla card di calcolare autonomamente la fase senza affidarsi a un sensore esterno — il che la rende indipendente dal REST sensor NASA e dal sensore `moon`. Questo è utile per avere ridondanza: anche se l'API NASA fosse irraggiungibile, la card continua a mostrare la fase calcolata internamente."}],"id":"A10::O0009","inference_kind":"explicit","label":"Ridondanza del calcolo lunare","review_status":"unreviewed"},{"description":"Il sensore delle fasi lunari è definito come aggregatore dei dati di un sensore nativo e di un sensore REST.","dimension":"semantic","evidence":[{"article_id":"A10","passage_id":"P0053","quote":"- **Relazione con gli altri sensori**: questo sensore è un *aggregatore* — non interroga API esterne, si limita a leggere `sensor.moon_phase` (nativo) e `sensor.nasa_moon_phase_info` (REST)."}],"id":"A10::O0010","inference_kind":"explicit","label":"Ruolo di aggregazione del sensore","review_status":"unreviewed"},{"description":"Il testo prevede che, se l'API NASA non è raggiungibile, al sensore aggregatore manchi soltanto l'immagine.","dimension":"decisional","evidence":[{"article_id":"A10","passage_id":"P0053","quote":"Se l'API NASA fosse irraggiungibile, lo stato in italiano e l'icona continuerebbero a funzionare; mancherebbe solo l'immagine."}],"id":"A10::O0011","inference_kind":"explicit","label":"Degradazione limitata all'immagine","review_status":"unreviewed"},{"description":"La chiusura annuncia il passaggio dal modulo Terra-Luna a una seconda parte dedicata al Sole.","dimension":"rhetorical","evidence":[{"article_id":"A10","passage_id":"P0056","quote":"In questa prima parte abbiamo costruito il modulo **Sistema Terra-Luna**. Nella {% post_link /home-assistant/dashboard-astrometria-parte-2/ \"seconda parte\" role=\"deepening\" context=\"extends-topic\" target=\"internal\" %} ci sposteremo, invece, sul Sole: immagini live da SOHO e GOES-16, la previsione delle aurore boreali OVATION, e i dati dello spazio meteorologico con grafici BT/BZ in tempo reale."}],"id":"A10::O0012","inference_kind":"explicit","label":"Anticipazione della seconda parte","review_status":"unreviewed"}],"processing":{"article_processed":true,"mode":"whole_article","passages_available":56,"passages_cited":10,"receipt":{"article_id":"A10","input_hash":"7c52178a869044c95346f786042c334c83a49e744e843f24c171f0d588450245","mode":"whole_article","prepare_returned":true,"session_id":"ses_ecbec852cffepbiItSQEA2v5QU","workflow_version":"host-session-whole-article/1"},"status":"complete"},"schema_version":"author-extraction/1.2","source":{"article_id":"A10","corpus_hash":"31ab2684da116696a53686fafa0dbe0adee6d6a3532d50ce4bde03e89cdc7d40","file_hash":"1bb94efcf926611d640b9fe1ee41007005d89019103a49f9001630105119b775","path":"_posts/home-assistant/2026-05-10-dashboard-astrometria-parte-1.md"}}