{"dimension_presence":{"decisional":{"observation_count":2,"status":"observed"},"epistemic":{"observation_count":4,"status":"observed"},"rhetorical":{"observation_count":2,"status":"observed"},"semantic":{"observation_count":4,"status":"observed"}},"measurements":{"advanced_stylometry":{"reason_code":"OUT_OF_SCOPE_V1","status":"not_computed","value":null},"nonblank_lines":64,"scope":"raw_markdown_body","unicode_code_points":8378,"utf8_bytes":8434},"method":{"instructions_hash":"045c72931d2ee40cc7541e40631f58fdff19aded62a0aa89fd3c60f6de4ae085","instructions_version":"author-extractor/1.2","measurement_version":"raw-body-counts/1","prepare_version":"prepare/1","schema_hash":"7de97394f5b8739ef123095468097d76ee9854771fc6732ce450d006537af649","segmentation_version":"raw-blank-lines/1","workflow_version":"host-session-whole-article/1"},"observations":[{"description":"L'apertura presenta l'elettromagnetismo e la dinamica classica in un parallelismo basato, rispettivamente, sulle leggi di Maxwell e sulle equazioni di Lagrange.","dimension":"rhetorical","evidence":[{"article_id":"A06","passage_id":"P0001","quote":"All'atto pratico, come l'elettromagnetismo parte dalle leggi di Maxwell, la dinamica classica parte dalle equazioni di Lagrange"}],"id":"A06::O0001","inference_kind":"explicit","label":"Parallelismo introduttivo","review_status":"unreviewed"},{"description":"L'espressione «ci tocca sbatterci un po' la testa» può coinvolgere il lettore nella prospettiva di uno sforzo condiviso.","dimension":"rhetorical","evidence":[{"article_id":"A06","passage_id":"P0002","quote":"Quindi ci tocca sbatterci un po' la testa, temo."}],"id":"A06::O0002","inference_kind":"inferred","label":"Sforzo condiviso","review_status":"unreviewed"},{"description":"Nell'apertura, l'importanza per la meccanica quantistica è motivata dalla messa in luce del formalismo algebrico della cinematica e della dinamica attraverso la formulazione hamiltoniana.","dimension":"epistemic","evidence":[{"article_id":"A06","passage_id":"P0002","quote":"Questo aspetto, attraverso la formulazione hamiltoniana che ne deriva e che vedremo successivamente, è essenziale in meccanica quantistica perché mette in luce il formalismo algebrico della cinematica e della dinamica, formalismo utilizzato più volte nella teoria."}],"id":"A06::O0003","inference_kind":"explicit","label":"Rilevanza quantistica del formalismo","review_status":"unreviewed"},{"description":"Il principio di determinismo è usato nel testo come fondamento dell'individuazione univoca delle soluzioni di Newton mediante le condizioni iniziali, a forza assegnata.","dimension":"epistemic","evidence":[{"article_id":"A06","passage_id":"P0013","quote":"Il __principio di determinismo__ che regola la meccanica classica ci consente di scrivere che, assegnata una forza _F_, ogni soluzione dell'equazione di Newton è univocamente individuata dalle condizioni iniziali del sistema."}],"id":"A06::O0004","inference_kind":"explicit","label":"Determinismo e condizioni iniziali","review_status":"unreviewed"},{"description":"Il testo dichiara che non approfondirà in questa sede il teorema di Cauchy-Kowalewska.","dimension":"decisional","evidence":[{"article_id":"A06","passage_id":"P0016","quote":"È il teorema di Cauchy-Kowalewska, ma avrò pietà e non lo approfondiremo in questa sede."}],"id":"A06::O0005","inference_kind":"explicit","label":"Rinvio del teorema di Cauchy-Kowalewska","review_status":"unreviewed"},{"description":"Il testo equipara il tasso di variazione dell'energia cinetica alla potenza della forza.","dimension":"semantic","evidence":[{"article_id":"A06","passage_id":"P0028","quote":"* Il tasso di variazione dell'energia cinetica è pari alla _potenza_ della forza;"}],"id":"A06::O0006","inference_kind":"explicit","label":"Potenza come tasso di variazione","review_status":"unreviewed"},{"description":"La trattazione assume che la massa del corpo sia costante.","dimension":"epistemic","evidence":[{"article_id":"A06","passage_id":"P0029","quote":"Ovviamente stiamo assumendo che (come avviene nella stragrande maggioranza dei casi) la massa _m_ sia costante;"}],"id":"A06::O0007","inference_kind":"explicit","label":"Assunzione di massa costante","review_status":"unreviewed"},{"description":"Il testo definisce una forza posizionale come dipendente solo dalla posizione nello spazio.","dimension":"semantic","evidence":[{"article_id":"A06","passage_id":"P0030","quote":"Supponiamo che sul corpo agisca una __forza posizionale__; non, quindi, una generica forza  $$ F(x, v, t) $$, ma una forza che dipende solo dalla posizione nello spazio in cui è applicata $$ F = F(x) $$."}],"id":"A06::O0008","inference_kind":"explicit","label":"Forza posizionale","review_status":"unreviewed"},{"description":"Il testo giustifica l'annullamento della derivata dell'energia con il fatto di considerare le soluzioni dell'equazione di Newton.","dimension":"epistemic","evidence":[{"article_id":"A06","passage_id":"P0051","quote":"$$ \\dot{E} = \\frac{dT}{dv}a + \\frac{dV}{dx}v = mva - Fv = v(ma - F) = 0 $$"},{"article_id":"A06","passage_id":"P0052","quote":"(il valore della precedente è zero perché ci muoviamo nel luogo delle soluzioni dell'equazione di Newton)"}],"id":"A06::O0009","inference_kind":"explicit","label":"Restrizione alle soluzioni newtoniane","review_status":"unreviewed"},{"description":"Nel testo le variabili dinamiche invarianti rispetto a un movimento in un sistema inerziale prendono il nome di «costanti di moto».","dimension":"semantic","evidence":[{"article_id":"A06","passage_id":"P0053","quote":"Le variabili dinamiche che godono di questa proprietà di invarianza rispetto a un movimento (in un sistema inerziale) sono dette __costanti di moto__."}],"id":"A06::O0010","inference_kind":"explicit","label":"Costanti di moto","review_status":"unreviewed"},{"description":"Il testo denomina «superfici di livello dell'energia» le superfici del diagramma delle fasi corrispondenti ai diversi livelli invarianti di energia iniziale.","dimension":"semantic","evidence":[{"article_id":"A06","passage_id":"P0057","quote":"Questo significa che i movimenti nel ritratto in fase sono distribuiti in \"fogli\" stratificati sui diversi livelli di energia iniziale, invariante, $$ E_0 $$. Per questo motivo, queste superfici sul diagramma delle fasi sono chiamate __superfici di livello dell'energia__."}],"id":"A06::O0011","inference_kind":"explicit","label":"Superfici di livello dell'energia","review_status":"unreviewed"},{"description":"La chiusura presenta l'articolo come un approfondimento formale destinato a facilitare la comprensione dei concetti successivi.","dimension":"decisional","evidence":[{"article_id":"A06","passage_id":"P0059","quote":"Prendete, quindi, questo articolo come un ostico, ma utile, approfondimento formale per meglio capire i concetti che verranno in seguito."}],"id":"A06::O0012","inference_kind":"explicit","label":"Finalità propedeutica dell'approfondimento","review_status":"unreviewed"}],"processing":{"article_processed":true,"mode":"whole_article","passages_available":59,"passages_cited":12,"receipt":{"article_id":"A06","input_hash":"6b5cb9796c8676ca1e37855fa27c65e3caaf25955e60fc51fd85f3d40c7fc890","mode":"whole_article","prepare_returned":true,"session_id":"ses_ecbec8559ffeK243pnMjWjLz0m","workflow_version":"host-session-whole-article/1"},"status":"complete"},"schema_version":"author-extraction/1.2","source":{"article_id":"A06","corpus_hash":"31ab2684da116696a53686fafa0dbe0adee6d6a3532d50ce4bde03e89cdc7d40","file_hash":"1fc22cef0a81ad397e0616f3633ae1ff326d8960271d240283144594d61c8762","path":"_posts/fisica/2019-11-06-teorema-energia-cinetica.md"}}