{"dimension_presence":{"decisional":{"observation_count":4,"status":"observed"},"epistemic":{"observation_count":3,"status":"observed"},"rhetorical":{"observation_count":3,"status":"observed"},"semantic":{"observation_count":2,"status":"observed"}},"measurements":{"advanced_stylometry":{"reason_code":"OUT_OF_SCOPE_V1","status":"not_computed","value":null},"nonblank_lines":135,"scope":"raw_markdown_body","unicode_code_points":17290,"utf8_bytes":17413},"method":{"instructions_hash":"045c72931d2ee40cc7541e40631f58fdff19aded62a0aa89fd3c60f6de4ae085","instructions_version":"author-extractor/1.2","measurement_version":"raw-body-counts/1","prepare_version":"prepare/1","schema_hash":"7de97394f5b8739ef123095468097d76ee9854771fc6732ce450d006537af649","segmentation_version":"raw-blank-lines/1","workflow_version":"host-session-whole-article/1"},"observations":[{"description":"L'apertura usa il disagio visivo del lavoro domestico come motivazione pratica per l'automazione proposta.","dimension":"rhetorical","evidence":[{"article_id":"A09","passage_id":"P0001","quote":"Chi lavora da casa conosce il problema: la luce cambia continuamente durante la giornata, e spesso ci si ritrova a lavorare al computer con una illuminazione inadeguata senza rendersene conto. Troppa luce crea abbagliamento sullo schermo, troppa poca affatica gli occhi. La soluzione ideale è un sistema che compensi automaticamente la luce naturale con quella artificiale, mantenendo l'illuminamento costante."}],"id":"A09::O0001","inference_kind":"inferred","label":"Motivazione pratica iniziale","review_status":"unreviewed"},{"description":"Nel progetto descritto, l'autore dichiara di non voler aggiungere sensori di illuminanza alla propria rete Zigbee già affollata.","dimension":"decisional","evidence":[{"article_id":"A09","passage_id":"P0004","quote":"I sensori di illuminanza fisici esistono, costano poco e funzionano bene. Ma non mi andava di acquistarli e di aggiungere altri dispositivi alla mia già piuttosto affollata costellazione Zigbee."}],"id":"A09::O0002","inference_kind":"explicit","label":"Vincolo sui dispositivi aggiuntivi","review_status":"unreviewed"},{"description":"Nel modello presentato, la luce isotropa non ha una provenienza privilegiata.","dimension":"semantic","evidence":[{"article_id":"A09","passage_id":"P0016","quote":"Le nuvole diffondono la radiazione solare in tutte le direzioni: la luce non ha più una provenienza privilegiata ma arriva **isotropicamente** da tutta la volta celeste, con intensità approssimativamente uniforme su ogni direzione."}],"id":"A09::O0003","inference_kind":"explicit","label":"Significato della luce isotropa","review_status":"unreviewed"},{"description":"La transizione tra i due regimi del modello è presentata come una semplificazione lineare.","dimension":"epistemic","evidence":[{"article_id":"A09","passage_id":"P0022","quote":"Per valori intermedi si ottiene una transizione continua tra i due comportamenti limite. Sempre che ci accontentiamo, come al solito, di una semplificazione lineare."}],"id":"A09::O0004","inference_kind":"explicit","label":"Semplificazione dell'interpolazione solare","review_status":"unreviewed"},{"description":"Il caso del soggiorno dell'autore offre una concretizzazione operativa del modello.","dimension":"rhetorical","evidence":[{"article_id":"A09","passage_id":"P0027","quote":"In Jinja2 per Home Assistant, per la finestra del mio soggiorno orientata a sud (azimuth 180°), nel mio appartamento a Milano:"},{"article_id":"A09","passage_id":"P0033","quote":"{% set lux_diretto = lux_ext * tau_g * cos_theta * (Af / A_room) %}\n{% set lux_indiretto = lux_ext * DF_indiretto %}\n{{ (lux_diretto + lux_indiretto) | round(0) }}"}],"id":"A09::O0005","inference_kind":"inferred","label":"Esempio applicativo domestico","review_status":"unreviewed"},{"description":"L'articolo considera l'approssimazione lineare tra brightness e lumen sufficiente per lo scopo del progetto.","dimension":"epistemic","evidence":[{"article_id":"A09","passage_id":"P0039","quote":"La linearità brightness → lumen è un'approssimazione (i LED non sono perfettamente lineari), ma sufficiente per questo scopo."}],"id":"A09::O0006","inference_kind":"explicit","label":"Adeguatezza della linearizzazione artificiale","review_status":"unreviewed"},{"description":"L'autore sceglie 400 lux come obiettivo predefinito regolabile dell'automazione.","dimension":"decisional","evidence":[{"article_id":"A09","passage_id":"P0050","quote":"Ho scelto 400 lux come target default, regolabile tramite un helper `input_number`, così da facilitare eventuali fine tuning successivi."}],"id":"A09::O0007","inference_kind":"explicit","label":"Obiettivo di illuminamento regolabile","review_status":"unreviewed"},{"description":"L'articolo distingue il controllo feedforward dalla retroazione in base all'assenza di misurazioni dell'illuminamento effettivo.","dimension":"semantic","evidence":[{"article_id":"A09","passage_id":"P0051","quote":"Dirò un'ovvietà, ma ci tengo a far notare che questo **non è un sistema retroazionato** in senso stretto. In un vero sistema a ciclo chiuso si misurerebbe l'illuminamento effettivo della stanza con un sensore fisico, si calcolerebbe l'errore rispetto al target, e si userebbe quell'errore per correggere l'intensità delle sorgenti luminose. Qui invece l'illuminamento reale non è mai misurato e non entra mai nel calcolo (che, poi, era la premessa dell'articolo!): si misura solo la **perturbazione** (la luce naturale stimata), e si usa un **modello del processo** (i lumen noti delle lampade) per calcolare preventivamente l'azione correttiva. È un controllo **feedforward**: efficiente e senza oscillazioni, ma che non si autocorregge se il modello è impreciso."}],"id":"A09::O0008","inference_kind":"explicit","label":"Distinzione tra feedforward e retroazione","review_status":"unreviewed"},{"description":"Durante lo smartworking, la soluzione proposta disabilita temporaneamente il controllo della brightness di Adaptive Lighting.","dimension":"decisional","evidence":[{"article_id":"A09","passage_id":"P0059","quote":"La soluzione è disabilitare temporaneamente il controllo brightness di AL durante le ore di smartworking, lasciandogli solo il controllo della temperatura colore:"}],"id":"A09::O0009","inference_kind":"explicit","label":"Sospensione della brightness adattiva","review_status":"unreviewed"},{"description":"La sufficienza della luce naturale è una condizione per restituire ad Adaptive Lighting il controllo completo.","dimension":"decisional","evidence":[{"article_id":"A09","passage_id":"P0061","quote":"Al termine dell'orario di lavoro, o se la luce naturale diventa sufficiente, AL riprende il controllo completo."}],"id":"A09::O0010","inference_kind":"explicit","label":"Ripristino con luce naturale sufficiente","review_status":"unreviewed"},{"description":"La mancanza frequente di dati di altezza negli elementi cartografici OSM viene addotta come ragione della scarsa utilità pratica di un modello di occlusione.","dimension":"epistemic","evidence":[{"article_id":"A09","passage_id":"P0064","quote":"I dati cartografici OSM, infatti, pur avendo quasi sempre i dati planimetrici degli edifici, mancano spesso dei dati di altezza, quindi il modello risultante avrebbe scarsa utilità pratica."}],"id":"A09::O0011","inference_kind":"explicit","label":"Limite dei dati di altezza","review_status":"unreviewed"},{"description":"Il beneficio pratico attribuito al sistema funge da contrappeso conclusivo ai limiti dichiarati.","dimension":"rhetorical","evidence":[{"article_id":"A09","passage_id":"P0065","quote":"Nonostante questi limiti, il risultato è un sistema che si comporta in modo fisicamente coerente e che migliora misurabilmente il comfort visivo durante le ore di lavoro, senza richiedere alcun intervento manuale o un sensore esterno."}],"id":"A09::O0012","inference_kind":"inferred","label":"Contrappeso conclusivo dei benefici","review_status":"unreviewed"}],"processing":{"article_processed":true,"mode":"whole_article","passages_available":65,"passages_cited":13,"receipt":{"article_id":"A09","input_hash":"e4bd364f7411ecfed8b85f36c777a0b2f97492f6bf1a93bf7a7318ac464e3899","mode":"whole_article","prepare_returned":true,"session_id":"ses_ecbec852dffeQRLG4M8BJ8UBYA","workflow_version":"host-session-whole-article/1"},"status":"complete"},"schema_version":"author-extraction/1.2","source":{"article_id":"A09","corpus_hash":"31ab2684da116696a53686fafa0dbe0adee6d6a3532d50ce4bde03e89cdc7d40","file_hash":"48697f09a962f1f7b0d80042ee057df9900bef3e470f7511222ccf20265787d5","path":"_posts/home-assistant/2026-05-09-illuminanza-smartworking-home-assistant.md"}}