{"dimension_presence":{"decisional":{"observation_count":3,"status":"observed"},"epistemic":{"observation_count":3,"status":"observed"},"rhetorical":{"observation_count":3,"status":"observed"},"semantic":{"observation_count":3,"status":"observed"}},"measurements":{"advanced_stylometry":{"reason_code":"OUT_OF_SCOPE_V1","status":"not_computed","value":null},"nonblank_lines":228,"scope":"raw_markdown_body","unicode_code_points":21958,"utf8_bytes":22188},"method":{"instructions_hash":"045c72931d2ee40cc7541e40631f58fdff19aded62a0aa89fd3c60f6de4ae085","instructions_version":"author-extractor/1.2","measurement_version":"raw-body-counts/1","prepare_version":"prepare/1","schema_hash":"7de97394f5b8739ef123095468097d76ee9854771fc6732ce450d006537af649","segmentation_version":"raw-blank-lines/1","workflow_version":"host-session-whole-article/1"},"observations":[{"description":"Nell'apertura, la reperibilità dei post appare come il problema che motiva la proposta di automazione SEO.","dimension":"rhetorical","evidence":[{"article_id":"A11","passage_id":"P0001","quote":"Pubblicare un articolo su un blog personale è facile. Assicurarsi che venga trovato dai motori di ricerca — e, sempre più, dai crawler AI — è un'altra storia."},{"article_id":"A11","passage_id":"P0003","quote":"Così, oggi mi sono detto: perché non automatizziamo anche la componente SEO?"}],"id":"A11::O0001","inference_kind":"inferred","label":"Cornice iniziale della reperibilità","review_status":"unreviewed"},{"description":"L'articolo dichiara di omettere il codice integrale per non appesantire la lettura.","dimension":"rhetorical","evidence":[{"article_id":"A11","passage_id":"P0013","quote":"In questo articolo non andrò a riportare il codice nella sua interezza, per non appesantire la lettura, ma solo i suoi principi di base e le sue caratteristiche più istruttive."}],"id":"A11::O0002","inference_kind":"explicit","label":"Omissione del codice integrale","review_status":"unreviewed"},{"description":"La battuta sul contesto disponibile sembra introdurre un tono colloquiale nella spiegazione dei paragrafi brevi.","dimension":"rhetorical","evidence":[{"article_id":"A11","passage_id":"P0056","quote":"- **Paragrafi corti.** Due o tre frasi al massimo. I blocchi di testo lunghi sono più difficili da processare, meno probabili da citare e occupano più contesto _(\"Che, signora mia, di contesto non ce n'è mai abbastanza!\")_."}],"id":"A11::O0003","inference_kind":"inferred","label":"Battuta sul contesto limitato","review_status":"unreviewed"},{"description":"Il testo attribuisce ad AI Advisors la tesi secondo cui i crawler AI cercano struttura dei contenuti, segnali di autorità e gerarchia degli heading.","dimension":"epistemic","evidence":[{"article_id":"A11","passage_id":"P0034","quote":"Secondo {% xlink \"https://www.ai-advisors.ai/blog/how-to-get-cited-by-microsoft-copilot\" \"AI Advisors\" role=\"source\" context=\"supports-claim\" target=\"external-authoritative\" %}, i crawler AI cercano tre cose: contenuti ben strutturati, segnali di autorità chiari, e una gerarchia di heading che renda ovvio di cosa parla ogni sezione."}],"id":"A11::O0004","inference_kind":"explicit","label":"Attribuzione dei criteri di crawlability","review_status":"unreviewed"},{"description":"L'affermazione che soltanto OpenAI usi lo standard llms.txt è circoscritta al momento della scrittura.","dimension":"epistemic","evidence":[{"article_id":"A11","passage_id":"P0037","quote":"Lo standard è ancora acerbo e usato da pochi attori (solo OpenAI, al momento in cui scrivo)"}],"id":"A11::O0005","inference_kind":"explicit","label":"Qualificazione temporale dell'adozione di llms.txt","review_status":"unreviewed"},{"description":"L'autore dichiara di aver impiegato due ore per capire il requisito di specificare le quattro categorie nell'API PageSpeed Insights.","dimension":"epistemic","evidence":[{"article_id":"A11","passage_id":"P0076","quote":"Nota bene: bisogna passare **esplicitamente** le quattro categorie con `&category=`, altrimenti l'API restituisce solo `performance`. Ci ho perso due ore a capirlo e vi risparmio volentieri questo strazio."}],"id":"A11::O0006","inference_kind":"explicit","label":"Esperienza di troubleshooting","review_status":"unreviewed"},{"description":"Il testo presenta i microformati come il mezzo per specificare ai motori di ricerca la natura degli elementi di contenuto.","dimension":"semantic","evidence":[{"article_id":"A11","passage_id":"P0042","quote":"I microformati sono il modo in cui dici ai motori di ricerca _cosa_ stai dicendo. Non \"questa è una stringa di testo\", ma \"questo è il titolo di un articolo, questo è l'autore, questo è un termine tecnico definito e questo sono io\"."}],"id":"A11::O0007","inference_kind":"explicit","label":"Ruolo semantico dei microformati","review_status":"unreviewed"},{"description":"Il glossario descritto rappresenta termini tecnici con definizioni e URL mediante entità DefinedTerm e DefinedTermSet.","dimension":"semantic","evidence":[{"article_id":"A11","passage_id":"P0046","quote":"Ho creato un glossario YAML (`_data/glossary.yml`) con i termini tecnici che uso più spesso nel blog — spin quantistico, autovettore, illuminamento, legge di potenza, ecc. — ciascuno con definizione e URL sotto forma di entità **`DefinedTerm` e `DefinedTermSet`**."}],"id":"A11::O0008","inference_kind":"explicit","label":"Glossario come insieme di entità","review_status":"unreviewed"},{"description":"Nell'articolo, la GEO è definita in funzione della frequenza di citazione nelle risposte generate anziché del ranking.","dimension":"semantic","evidence":[{"article_id":"A11","passage_id":"P0053","quote":"La Generative Engine Optimization (GEO) è la pratica di strutturare i contenuti perché vengano citati dai motori di ricerca AI — ChatGPT, Perplexity, Claude, Gemini. Non si tratta di ranking. Si tratta di _citation rate_: quanto spesso il tuo brand appare nelle risposte generate."}],"id":"A11::O0009","inference_kind":"explicit","label":"GEO e frequenza di citazione","review_status":"unreviewed"},{"description":"Il testo giustifica l'adozione dello standard llms.txt con il suo costo ridotto.","dimension":"decisional","evidence":[{"article_id":"A11","passage_id":"P0037","quote":"Lo standard è ancora acerbo e usato da pochi attori (solo OpenAI, al momento in cui scrivo), ma adottarlo costa talmente poco che non farlo sarebbe pigrizia."}],"id":"A11::O0010","inference_kind":"explicit","label":"Adozione a basso costo dello standard llms.txt","review_status":"unreviewed"},{"description":"L'autore presenta come sfida di scrittura il bilanciamento fra pathos per il lettore e assenza di penalizzazioni da parte delle AI.","dimension":"decisional","evidence":[{"article_id":"A11","passage_id":"P0056","quote":"E qui la sfida per me sta proprio nello scrivere un testo un minimo sospensivo che crei  _pathos_ per il lettore, ma che non sia penalizzato dalle AI."}],"id":"A11::O0011","inference_kind":"explicit","label":"Bilanciamento fra pathos e vincoli AI","review_status":"unreviewed"},{"description":"La scelta di eseguire Lighthouse dopo il deploy è motivata dal rischio di falsi positivi legati agli asset CDN non ancora disponibili durante il build.","dimension":"decisional","evidence":[{"article_id":"A11","passage_id":"P0090","quote":"Nel mio caso, ad esempio, che uso una CDN per le immagini, durante il build gli asset non sono ancora pubblici e i loro URL non sono ancora risolti. L'audit pre-deploy soffrirebbe di falsi positivi. Eseguo quindi Lighthouse **post-deploy**, quando il sito è live e Cloudinary ha già cachato tutte le immagini."}],"id":"A11::O0012","inference_kind":"explicit","label":"Audit Lighthouse dopo il deploy","review_status":"unreviewed"}],"processing":{"article_processed":true,"mode":"whole_article","passages_available":104,"passages_cited":11,"receipt":{"article_id":"A11","input_hash":"77ea6144d7eba00f54ec9e25c70fdc0275f91e6a0cb104487b22be66cd42301a","mode":"whole_article","prepare_returned":true,"session_id":"ses_ecbec852bffeLXSaeUw6qrRsSj","workflow_version":"host-session-whole-article/1"},"status":"complete"},"schema_version":"author-extraction/1.2","source":{"article_id":"A11","corpus_hash":"31ab2684da116696a53686fafa0dbe0adee6d6a3532d50ce4bde03e89cdc7d40","file_hash":"cac67ce2a6e254fe4b427eae422f90cb8a3ce31562efc81ede3d89fcbb029531","path":"_posts/devops/2026-05-16-seo-automatico-jekyll.md"}}