{"dimension_presence":{"decisional":{"observation_count":3,"status":"observed"},"epistemic":{"observation_count":3,"status":"observed"},"rhetorical":{"observation_count":3,"status":"observed"},"semantic":{"observation_count":3,"status":"observed"}},"measurements":{"advanced_stylometry":{"reason_code":"OUT_OF_SCOPE_V1","status":"not_computed","value":null},"nonblank_lines":38,"scope":"raw_markdown_body","unicode_code_points":8841,"utf8_bytes":8899},"method":{"instructions_hash":"045c72931d2ee40cc7541e40631f58fdff19aded62a0aa89fd3c60f6de4ae085","instructions_version":"author-extractor/1.2","measurement_version":"raw-body-counts/1","prepare_version":"prepare/1","schema_hash":"7de97394f5b8739ef123095468097d76ee9854771fc6732ce450d006537af649","segmentation_version":"raw-blank-lines/1","workflow_version":"host-session-whole-article/1"},"observations":[{"description":"L'apertura sembra invitare il lettore a condividere l'impostazione del problema.","dimension":"rhetorical","evidence":[{"article_id":"A07","passage_id":"P0001","quote":"Supponiamo di voler studiare la dinamica di un sistema inerziale composto da un singolo punto materiale in moto nello spazio."}],"id":"A07::O0001","inference_kind":"inferred","label":"Invito alla costruzione condivisa","review_status":"unreviewed"},{"description":"Una breve frase annuncia il passaggio a un esempio.","dimension":"rhetorical","evidence":[{"article_id":"A07","passage_id":"P0010","quote":"Ma forse è il caso di fare un esempio."}],"id":"A07::O0002","inference_kind":"explicit","label":"Annuncio dell'esempio","review_status":"unreviewed"},{"description":"Nella definizione proposta, spazio degli stati e spazio delle fasi sono denominazioni dello stesso spazio dei possibili stati dinamici del sistema.","dimension":"semantic","evidence":[{"article_id":"A07","passage_id":"P0006","quote":"Lo spazio generato da questo prodotto cartesiano descrive ogni possibile stato dinamico del sistema e prende il nome, per l'appunto, di spazio degli stati o __spazio delle fasi__."}],"id":"A07::O0003","inference_kind":"explicit","label":"Equivalenza terminologica","review_status":"unreviewed"},{"description":"Per il caso considerato, il testo afferma l'esistenza di una sola soluzione dell'equazione di Newton a partire da un punto iniziale dello spazio delle fasi.","dimension":"epistemic","evidence":[{"article_id":"A07","passage_id":"P0007","quote":"Nel caso specifico, fissata una forza _F_ come una ben definita funzione delle condizioni iniziali e, genericamente, dal tempo _t_, ovvero _F(x, v, t)_, esiste una e una sola soluzione all'equazione di Newton che al tempo iniziale $$ t_0 $$ parte da un punto $$ {x_0, v_0} $$ dello spazio delle fasi e che determina l'evoluzione futura del sistema lungo _t_ secondo le leggi della meccanica (l'equazione differenziale del moto)."}],"id":"A07::O0004","inference_kind":"explicit","label":"Unicità della soluzione","review_status":"unreviewed"},{"description":"Il testo presenta il ritratto di fase come applicabile a sistemi dinamici di qualsiasi natura e dimensionalità.","dimension":"semantic","evidence":[{"article_id":"A07","passage_id":"P0012","quote":"Il concetto di ritratto di fase è del tutto generale e non è legato necessariamente a un sistema meccanico (descritto dalle equazioni del moto di Newton), ma può essere utilizzato su sistemi dinamici di qualsiasi natura e con un numero qualsiasi di dimensioni."}],"id":"A07::O0005","inference_kind":"explicit","label":"Generalità del ritratto di fase","review_status":"unreviewed"},{"description":"Per rendere il diagramma facilmente visualizzabile sul piano cartesiano, l'articolo sceglie un esempio meccanico con movimento in una dimensione.","dimension":"decisional","evidence":[{"article_id":"A07","passage_id":"P0015","quote":"Per essere pratici, useremo perciò nel nostro esempio un sistema meccanico caratterizzato da un movimento in una dimensione, così da avere un diagramma di fase facilmente visualizzabile in un piano cartesiano con la posizione sull'asse delle ascisse e il relativo gradiente sull'asse delle ordinate."}],"id":"A07::O0006","inference_kind":"explicit","label":"Criterio di visualizzabilità","review_status":"unreviewed"},{"description":"Nell'esempio del pendolo, il termine ideale è definito dall'assenza di forze di attrito nel sistema di riferimento considerato.","dimension":"semantic","evidence":[{"article_id":"A07","passage_id":"P0021","quote":"Si dice _ideale_ in quanto, nel sistema di riferimento inerziale preso in esame, si considerano nulle le forze di attrito."}],"id":"A07::O0007","inference_kind":"explicit","label":"Idealità senza attrito","review_status":"unreviewed"},{"description":"Il testo rinvia a un articolo successivo la trattazione dettagliata del determinismo laplaciano.","dimension":"decisional","evidence":[{"article_id":"A07","passage_id":"P0022","quote":"È il concetto base del __determinismo laplaciano__, che però studieremo nel dettaglio in uno dei prossimi articoli."}],"id":"A07::O0008","inference_kind":"explicit","label":"Rinvio del determinismo laplaciano","review_status":"unreviewed"},{"description":"La spiegazione del diagramma organizza le traiettorie in gruppi identificati dai colori arancione, blu e rosso.","dimension":"rhetorical","evidence":[{"article_id":"A07","passage_id":"P0027","quote":"* Le traiettorie in __arancione__ sono caratterizzate da un gradiente di velocità angolare che a un certo punto cambia segno."},{"article_id":"A07","passage_id":"P0028","quote":"* Le traiettorie in __blu__ sono caratterizzate da velocità angolari iniziali sufficienti per far girare il pendolo su se stesso (attorno al proprio vincolo)."},{"article_id":"A07","passage_id":"P0029","quote":"* Le traiettorie in __rosso__ sono gli unici due punti di equilibrio del sistema"}],"id":"A07::O0009","inference_kind":"explicit","label":"Classificazione cromatica","review_status":"unreviewed"},{"description":"L'articolo qualifica la rappresentazione presentata come approssimata perché le equazioni non sono state risolte.","dimension":"epistemic","evidence":[{"article_id":"A07","passage_id":"P0032","quote":"Giacché non abbiamo risolto suddette equazioni, ne fornisce solo una vista approssimata"}],"id":"A07::O0010","inference_kind":"explicit","label":"Approssimazione dichiarata","review_status":"unreviewed"},{"description":"Il testo considera la visualizzazione meno efficace all'aumentare dell'ordine del sistema.","dimension":"epistemic","evidence":[{"article_id":"A07","passage_id":"P0033","quote":"Certo, al crescere dell'ordine del sistema, la visualizzazione diventa complessa e inefficace, per non dire impossibile."}],"id":"A07::O0011","inference_kind":"explicit","label":"Limite della visualizzazione","review_status":"unreviewed"},{"description":"L'articolo annuncia esempi futuri di ritratti di fase in R in ragione della disponibilità di un package giudicato semplice e intuitivo.","dimension":"decisional","evidence":[{"article_id":"A07","passage_id":"P0034","quote":"Prossimamente faremo qualche esempio pratico di realizzazione di ritratti di fase tramite R, visto che [esiste un package](https://cran.r-project.org/web/packages/phaseR/vignettes/my-vignette.html) semplice e intuitivo adatto allo scopo."}],"id":"A07::O0012","inference_kind":"explicit","label":"Programmazione di esempi in R","review_status":"unreviewed"}],"processing":{"article_processed":true,"mode":"whole_article","passages_available":34,"passages_cited":14,"receipt":{"article_id":"A07","input_hash":"a113fc706c6662f84aebaed508742ca8d63bcad2db8b971ba804e7e9b7523819","mode":"whole_article","prepare_returned":true,"session_id":"ses_ecbec852effeByA5pHMi5EZU5d","workflow_version":"host-session-whole-article/1"},"status":"complete"},"schema_version":"author-extraction/1.2","source":{"article_id":"A07","corpus_hash":"31ab2684da116696a53686fafa0dbe0adee6d6a3532d50ce4bde03e89cdc7d40","file_hash":"2dc6b257bc5411f7f1bec3156138772951fc7c9ca841317bb3ae30eb9b7c375b","path":"_posts/meccanica/2019-10-31-spazio-degli-stati.md"}}