{"dimension_presence":{"decisional":{"observation_count":2,"status":"observed"},"epistemic":{"observation_count":2,"status":"observed"},"rhetorical":{"observation_count":3,"status":"observed"},"semantic":{"observation_count":3,"status":"observed"}},"measurements":{"advanced_stylometry":{"reason_code":"OUT_OF_SCOPE_V1","status":"not_computed","value":null},"nonblank_lines":19,"scope":"raw_markdown_body","unicode_code_points":3894,"utf8_bytes":3930},"method":{"instructions_hash":"045c72931d2ee40cc7541e40631f58fdff19aded62a0aa89fd3c60f6de4ae085","instructions_version":"author-extractor/1.2","measurement_version":"raw-body-counts/1","prepare_version":"prepare/1","schema_hash":"7de97394f5b8739ef123095468097d76ee9854771fc6732ce450d006537af649","segmentation_version":"raw-blank-lines/1","workflow_version":"host-session-whole-article/1"},"observations":[{"description":"La definizione iniziale dell'elettronvolt lo identifica con il lavoro elettrostatico su un elettrone in uno spostamento fra punti con differenza di potenziale di un volt.","dimension":"semantic","evidence":[{"article_id":"A08","passage_id":"P0001","quote":"In pratica, esso coincide con il lavoro compiuto dalla forza elettrostatica agente su un elettrone che si muove nel vuoto in un campo elettromagnetico quando la particella si sposta da un punto iniziale e finale aventi differenza di potenziale di 1 Volt."}],"id":"A08::O0001","inference_kind":"explicit","label":"Definizione operativa dell'elettronvolt","review_status":"unreviewed"},{"description":"Il richiamo al sollevamento di una massa nella gravità terrestre sembra offrire un riferimento concreto per comprendere la piccolezza dell'elettronvolt.","dimension":"rhetorical","evidence":[{"article_id":"A08","passage_id":"P0004","quote":"Ricordando come 1 J sia il lavoro compiuto da una forza per spostare una massa di 1kg per un metro (o in alternativa di sollevare a 1m di altezza una massa di poco più di 100gr soggetta alla gravità terrestre), ne consegue che un elettronvolt sia una quantità di energia molto piccola."}],"id":"A08::O0002","inference_kind":"inferred","label":"Riferimento a una scala quotidiana","review_status":"unreviewed"},{"description":"Il testo motiva l'uso dei multipli dell'elettronvolt con la piccolezza dell'unità di base.","dimension":"decisional","evidence":[{"article_id":"A08","passage_id":"P0004","quote":"Ricordando come 1 J sia il lavoro compiuto da una forza per spostare una massa di 1kg per un metro (o in alternativa di sollevare a 1m di altezza una massa di poco più di 100gr soggetta alla gravità terrestre), ne consegue che un elettronvolt sia una quantità di energia molto piccola. Per questo motivo, spesso si utilizza uno dei suoi multipli come il megaelettronvolt (MeV) o il gigaelettronvolt (GeV), soprattutto quando si utilizza l'elettronvolt come unità di misura per la massa."}],"id":"A08::O0003","inference_kind":"explicit","label":"Scelta dei multipli","review_status":"unreviewed"},{"description":"Il testo individua nell'uso dell'elettronvolt come unità di massa una fonte di confusione, soprattutto nella fisica delle alte energie.","dimension":"semantic","evidence":[{"article_id":"A08","passage_id":"P0005","quote":"Ciò che, infatti, genera più spesso confusione nell'uso dell'elettronvolt è il fatto che, soprattutto in fisica delle alte energie, questo sia utilizzato anche come unità di misura per la massa."}],"id":"A08::O0004","inference_kind":"explicit","label":"Uso dell'elettronvolt per la massa","review_status":"unreviewed"},{"description":"Il testo organizza la spiegazione dell'uso dell'elettronvolt per la massa attraverso sequenze di domanda e risposta.","dimension":"rhetorical","evidence":[{"article_id":"A08","passage_id":"P0005","quote":"Cosa significa questo?"},{"article_id":"A08","passage_id":"P0006","quote":"Per rispondere alla domanda, vediamo la definizione dimensionale dell'energia:"},{"article_id":"A08","passage_id":"P0012","quote":"Ma perché proprio _c_?"},{"article_id":"A08","passage_id":"P0013","quote":"Per rispondere a questa domanda, basti ricordare l'equazione dell'equivalenza di massa-energia, ovvero la famosissima $$ E = mc^2 $$ della relatività ristretta, che esprime il legame tra la massa a riposo e l'energia, attraverso la costante rappresentata dalla velocità della luce nel vuoto."}],"id":"A08::O0005","inference_kind":"explicit","label":"Sequenze domanda-risposta","review_status":"unreviewed"},{"description":"Il testo giustifica l'uso dell'elettronvolt diviso per il quadrato della velocità della luce come unità di massa tramite la riduzione dell'equazione dimensionale alla sola massa.","dimension":"epistemic","evidence":[{"article_id":"A08","passage_id":"P0011","quote":"Andando ora a dividere l'espressione ancora una volta per la velocità, nell'equazione dimensionale rimane solo la misura della massa _m_. Quindi, per misurare la massa si può usare come unità di misura $$ eV/c^2 $$."}],"id":"A08::O0006","inference_kind":"explicit","label":"Giustificazione dimensionale dell'unità di massa","review_status":"unreviewed"},{"description":"Il testo giustifica il ricorso alla velocità della luce nella conversione fra energia e massa richiamando l'equivalenza massa-energia della relatività ristretta.","dimension":"epistemic","evidence":[{"article_id":"A08","passage_id":"P0012","quote":"Ma perché proprio _c_?"},{"article_id":"A08","passage_id":"P0013","quote":"Per rispondere a questa domanda, basti ricordare l'equazione dell'equivalenza di massa-energia, ovvero la famosissima $$ E = mc^2 $$ della relatività ristretta, che esprime il legame tra la massa a riposo e l'energia, attraverso la costante rappresentata dalla velocità della luce nel vuoto."}],"id":"A08::O0007","inference_kind":"explicit","label":"Richiamo all'equivalenza massa-energia","review_status":"unreviewed"},{"description":"Il testo propone la massa dell'elettrone come esempio numerico di conversione dai chilogrammi a un'unità basata sull'elettronvolt.","dimension":"rhetorical","evidence":[{"article_id":"A08","passage_id":"P0016","quote":"Ad esempio, la massa dell'elettrone:"},{"article_id":"A08","passage_id":"P0017","quote":"$$ m_e = 9,109 \\times 10^{-31} kg = \\frac{9,109 \\times 10^{-31}}{1,78 \\times 10^{-36}} = 0,511 \\times 10^6 eV/c^2 = 0,511 MeV/c^2 $$"}],"id":"A08::O0008","inference_kind":"explicit","label":"Esempio della massa dell'elettrone","review_status":"unreviewed"},{"description":"Nella conclusione, il testo attribuisce alla semplificazione della notazione e dei calcoli l'uso di un sistema in cui la velocità della luce è adimensionale e pari a uno.","dimension":"decisional","evidence":[{"article_id":"A08","passage_id":"P0019","quote":"C'è da dire, infine, che soprattutto in fisica teorica, per semplificare la notazione (e i calcoli) i fisici usano un sistema di riferimento in cui la velocità della luce del vuoto _c_ è adimensionale e pari a 1."}],"id":"A08::O0009","inference_kind":"explicit","label":"Semplificazione notazionale","review_status":"unreviewed"},{"description":"Il testo afferma che spazio e tempo sono esprimibili mediante l'inverso dell'energia quando la velocità della luce e la costante di Planck ridotta sono entrambe adimensionali e pari a uno.","dimension":"semantic","evidence":[{"article_id":"A08","passage_id":"P0019","quote":"C'è da dire, infine, che soprattutto in fisica teorica, per semplificare la notazione (e i calcoli) i fisici usano un sistema di riferimento in cui la velocità della luce del vuoto _c_ è adimensionale e pari a 1. In questi sistemi, chiaramente, l'unità di misura della massa diventa semplicemente l'eV. Quando anche la costante di Planck ridotta _ħ_ è adimensionale e pari ad uno, anche spazio e tempo sono esprimibili con l'inverso dell'energia, cioè $$ eV^{-1} $$, e quindi l'elettronvolt, in questi sistemi, può esprimere anche distanze e intervalli di tempo."}],"id":"A08::O0010","inference_kind":"explicit","label":"Estensione condizionata a spazio e tempo","review_status":"unreviewed"}],"processing":{"article_processed":true,"mode":"whole_article","passages_available":19,"passages_cited":10,"receipt":{"article_id":"A08","input_hash":"cd8d464a2a7756eb7ee818ce23641ebad1e81573a609094cfbe255e4e40ff6b4","mode":"whole_article","prepare_returned":true,"session_id":"ses_ecbec852effdvQ6dSJ7V5uG51H","workflow_version":"host-session-whole-article/1"},"status":"complete"},"schema_version":"author-extraction/1.2","source":{"article_id":"A08","corpus_hash":"31ab2684da116696a53686fafa0dbe0adee6d6a3532d50ce4bde03e89cdc7d40","file_hash":"2bcbed9f554a9689d82575e2e8205731fea4567cb6fcd8a1e5ce67061ccda2da","path":"_posts/fisica/2021-05-06-elettronvolt.md"}}